,Age (in years),Resting blood pressure (in mm Hg on admission to the hospital),Serum cholesterol (in mg/dl),Maximum heart rate achieved,ST depression induced by exercise relative to rest,Number of major vessels (0–3) colored by fluoroscopy
Age (in years),1.0,0.27993314902321403,0.20837913091254623,-0.3856713057312332,0.20724191439477346,0.3348550849192325
Resting blood pressure (in mm Hg on admission to the hospital),0.27993314902321403,1.0,0.1350402104224777,-0.021717862600681467,0.1925449929002884,0.0862334350734
Serum cholesterol (in mg/dl),0.20837913091254623,0.1350402104224777,1.0,-0.036682227644715584,0.054240356668860776,0.09376161284766239
Maximum heart rate achieved,-0.3856713057312332,-0.021717862600681467,-0.036682227644715584,1.0,-0.3803545474689089,-0.26530155691190604
ST depression induced by exercise relative to rest,0.20724191439477346,0.1925449929002884,0.054240356668860776,-0.3803545474689089,1.0,0.28726881557151107
Number of major vessels (0–3) colored by fluoroscopy,0.3348550849192325,0.0862334350734,0.09376161284766239,-0.26530155691190604,0.28726881557151107,1.0
